ID,Title,Abstract,Keywords,Platform_Type,Research_Area,System_Architecture,Agent_Role,Behavior_Mechanism,Evaluation_Method,Experimental_Design,Challenge_Type,Research_Gap,Evaluation_Limitations,Authors,Year,Source_Name,Publication_Type
"55","Tiny Multiagent DRL for Twins Migration in UAV Metaverses: A Multileader Multifollower Stackelberg Game Approach","The synergy between unmanned aerial vehicles (UAVs) and metaverses is giving rise to an emerging paradigm named UAV metaverses, which create a unified ecosystem that blends physical and virtual spaces, transforming drone interaction and virtual exploration. UAV twins (UTs), as the digital twins of UAVs that revolutionize UAV applications by making them more immersive, realistic, and informative, are deployed and updated on ground base stations, e.g., roadside units (RSUs), to offer metaverse services for UAV metaverse users (UMUs). Due to the dynamic mobility of UAVs and limited communication coverages of RSUs, it is essential to perform real-time UT migration to ensure seamless immersive experiences for UMUs. However, selecting appropriate RSUs and optimizing the required bandwidth is challenging for achieving reliable and efficient UT migration. To address the challenges, we propose a tiny machine learning-based Stackelberg game framework based on pruning techniques for efficient UT migration in UAV metaverses. Specifically, we formulate a multileader multifollower Stackelberg model considering a new immersion metric of UMUs in the utilities of UAVs. Then, we design a Tiny multiagent deep reinforcement learning (Tiny MADRL) algorithm to obtain the tiny networks representing the optimal game solution. Specifically, the actor-critic network leverages the pruning techniques to reduce the number of network parameters and achieve model size and computation reduction, allowing for efficient implementation of Tiny MADRL. Numerical results demonstrate that our proposed schemes have better performance than traditional schemes.","Metaverses, multiagent deep reinforcement learning, pruning techniques, Stackelberg game, UAV twins (UTs)",UAV Metaverse Platform,UAV Metaverses with Digital Twin Migration and Multiagent Deep Reinforcement Learning,"The system architecture consists of UAVs, ground base stations (RSUs), and UAV metaverse users (UMUs). UTs are deployed on RSUs, and the system facilitates UT migration between RSUs to ensure seamless services for UMUs.","RSUs act as leaders setting bandwidth prices, UAVs act as followers deciding bandwidth purchase for UT migration, and UMUs are service consumers.","The behavior mechanism combines a multileader multifollower Stackelberg game model with the Tiny MADRL algorithm, using pruning techniques to reduce model complexity and achieve optimal resource allocation.","Simulation experiments comparing Tiny MADRL with traditional PPO, greedy, and random algorithms, measuring average reward convergence, strategy evolution, and impact of parameters like bandwidth cost and upper price.","Simulations with 5 RSUs, 15 UAVs, and parameters such as additive white Gaussian noise, channel gain, and transmit power. Experiments vary the number of RSUs/UAVs and analyze strategy convergence and reward changes.","Dynamic UT migration due to UAV mobility and limited RSU coverage, optimizing bandwidth allocation and pricing under information asymmetry, and ensuring immersive experiences for UMUs.","Existing works lack efficient UT migration solutions combining Stackelberg games with tiny DRL and pruning techniques, and few consider metaverse immersion metrics in utility functions.","Simulations assume unlimited RSU resources and fixed environments, not fully reflecting real-world dynamic UAV movements and changing network conditions.","Jiawen Kang, Yue Zhong, Minrui Xu, Jiangtian Nie, Jinbo Wen, Hongyang Du, Dongdong Ye, Xumin Huang, Dusit Niyato, Shengli Xie",2024,IEEE Internet of Things Journal,Journal article
"56","The impact of eye gaze on social interactions of females in virtual reality: The mediating role of the uncanniness of avatars and the moderating role of task type","This study investigates how avatar eye gaze behavior (static vs. tracked) affects perceived quality of communication (QoC) and one-sided eye contact in VR, with a focus on the mediating role of avatar uncanniness and the moderating role of task type (communication vs. collaboration). Results show that uncanniness negatively impacts QoC but does not mediate the relationship between gaze behavior and social interaction metrics.","Virtual reality, Eye tracking, Multi-agent, Avatar uncanniness, Communication, Collaboration","Virtual Reality (VR)","Human-Computer Interaction, Social VR","Dyadic VR Interaction","Avatars, Participants","Static vs. Tracked Eye Gaze","Quantitative Questionnaires, Eye Gaze Data","HTC VIVE Pro Eye, Unity, 44 Female Participants","Limited realism in avatar behavior, Gender bias","Mediation effect of uncanniness not significant","Female-only sample, Limited facial tracking","Aleksandra Zheleva, Julie Hardeman, Wouter Durnez, Charlotte Vanroelen, Jonas De Bruyne, Dennis Osei Tutu, Jessica Morton, Jamil Joundi, Jelle Saldien, Klaas Bombeke","2023","Heliyon","Journal Article"
"57","Toward Human Digital Twins for Cybersecurity Simulations on the Metaverse: Ontological and Network Science Approach","Background: Cyber defense is reactive and slow. On average, the time-to-remedy is hundreds of times larger than the time-to-compromise. In response, Human Digital Twins (HDTs) offer the capability of running massive simulations across multiple domains on the Metaverse. Simulated results may predict adversaries' behaviors and tactics, leading to more proactive cyber defense strategies. However, current HDTs’ cognitive architectures are underdeveloped for such use. Objective: This paper aims to make a case for extending the current digital cognitive architectures as the first step toward more robust HDTs that are suitable for realistic Metaverse cybersecurity simulations. Methods: This study formally documented 108 psychology constructs and thousands of related paths based on 20 time-tested psychology theories, all of which were packaged as Cybonto—a novel ontology. Then, this study applied 20 network science centrality algorithms in ranking the Cybonto psychology constructs by their influences. Results: Out of 108 psychology constructs, the top 10 are Behavior, Arousal, Goals, Perception, Self-efficacy, Circumstances, Evaluating, Behavior-Controllability, Knowledge, and Intentional Modality. In this list, only Behaviors, Goals, Perception, Evaluating, and Knowledge are parts of existing digital cognitive architectures. Notably, some of the constructs are not explicitly implemented. Early usability tests demonstrate that Cybonto can also be useful for immediate uses such as manual analysis of hackers’ behaviors and automatic analysis of behavioral cybersecurity knowledge texts. Conclusions: The results call for specific extensions of current digital cognitive architectures such as explicitly implementing more refined structures of Long-term Memory and Perception, placing a stronger focus on noncognitive yet influential constructs such as Arousal, and creating new capabilities for simulating, reasoning about, and selecting circumstances.","human behavior modeling, cognitive twins, human digital twins, cybersecurity, cognitive systems, digital twins, Metaverse, artificial intelligence","Metaverse Platform"," Metaverse, artificial intelligence","The system architecture includes the Metaverse with interconnected Digital Twin (DT) networks, Human Digital Twins (HDTs), and nonhuman DTs representing various components like information systems. It features three environments: internal, in-group, and societal, following Bronfenbrenner's Ecological System Theory.","HDTs represent human actors (malicious hackers, defenders, system users), while nonhuman DTs model technical components. HDTs interact with other DTs and environments to simulate cyber behaviors.","The behavior mechanism uses the Cybonto ontology to model human psychological constructs and their relationships, combined with network science centrality algorithms to rank construct influences. It extends digital cognitive architectures to include noncognitive factors.","Usability tests for manual analysis of hackers' behaviors using Cybonto, automatic analysis of behavioral cybersecurity research papers, and simulation of HDTs in different environments.","Workshop with cybersecurity professionals analyzing biographies of cyber actors using Cybonto, and natural language processing analysis of over 3000 behavioral cybersecurity research papers.","Developing robust HDTs for cybersecurity simulations, addressing underdeveloped cognitive architectures, and creating a reference ontology for behavioral cybersecurity knowledge.","Current HDTs lack comprehensive cognitive architectures for cybersecurity simulations, and existing cybersecurity ontologies are fragmented with weak ontological commitments.","Cybonto is in an alpha release stage, requiring cross-checking by psychologists and ontology testing. Implementations may face integrity issues from uncareful construct additions/removals.",Tam N Nguyen,2022,JMIRx Med,Journal article
"58","The Transformation of the New Media Communication Paradigm in the Metaverse Era and Blockchain Based on the Topological Characteristics of Information Communication","Keeping pace with the times, this paper analyzes and interprets the concept, characteristics of Metaverse, and its influence on new media communication. Based on this, under the topological characteristics of information communication, this paper discusses the transformation of new media communication paradigm in the metaverse era and models the prediction of new media information dissemination in metaverse. In this paper, the multi-agent modeling method is used to analyze and compare the evolution results of each agent attribute under different parameter values. At the same time, based on the ideal social media network, the improved integrated immune control strategy is applied to the dynamic model of epidemic (SEIR) with latent period, and the spreading and evolution process of rumors before and after immunization is simulated. This research has both theoretical value and practical application value, which can provide a useful reference for the follow-up research of new media communication.","Blockchain, Information Dissemination, Metaverse, New Media",Metaverse and Blockchain Platform,Metaverse and Blockchain,"The system architecture integrates metaverse and blockchain technologies, combining multi-agent modeling and SEIR dynamic model to analyze information dissemination networks. It includes social media networks, government-media-netizen interaction systems, and uses topological characteristics like degree distribution and clustering coefficients.","Agents include netizens as information disseminators/receivers, government as regulators, and online media as intermediaries, interacting within social network structures.","The behavior mechanism uses multi-agent modeling to simulate agent interactions under different parameters and applies an improved SEIR model with immune control strategy to simulate rumor spreading, considering network topological features like degree, path length, and density.","Simulation experiments on ideal social networks, BA scale-free network modeling, and prediction error analysis with 95.208% accuracy using Repast platform and dataset analysis.","Constructed BA scale-free network with 50 and 2000 nodes, used SIR model to classify nodes, simulated rumor spreading before/after immunization, and analyzed degree distribution and clustering coefficients.","Ensuring data privacy/security in metaverse, addressing computational resource demands, and balancing virtual-real integration in communication.","Limited literature on metaverse-media integration, lack of comprehensive models for information dissemination dynamics, and need for more real-world data validation.","Metaverse being a novel field with limited literature, model complexity affecting data availability, and differing academic definitions impacting research consistency.",Jinping Zhang,2024,International Journal of Web Services Research,Journal article
"59","The Simulation Methods in Library and Information Science: Method, Application and Future Directions","[Purpose/Significance] The application of simulation methods will be of great significance to the solution of various complex problems in the subject of graphics and information in the discipline of Library and Information Science. It is necessary to summarize the present status and future prospects of simulation methods applied in this discipline. [Design/Methodology] Taking relevant literatures of domestic and foreign journals as the research object, the research progress of simulation methods applied in the discipline of library and information was reviewed and analyzed with a systematic method. [Findings/Conclusion] The conditions and characteristics of simulation methods applied in Library and Information Science,such as multi-agent simulation, system dynamics, complex networks, and cellular automata , was summarized and analyzed comparatively with the traditional methods.Application status of these methods in the fields of information dissemination and network public opinion, knowledge management, scientific evaluation, and competitive intelligence was outlined.The idea of in-depth and wide application of the simulation method in this discipline with the development of big data and metaverse technologies was put forwarded. [Originality/Value] Through systematically summarisionof the existing research on the application of simulation methods in the discipline of Library and Information Science , the direction of future research was clarified combined with new scenarios in the new era, which has certain reference value for researchers.","Simulation; Library and Information Science; Multi-agent; System dynamics; Data driven; Metaverse",Science Research Platform,Library and Information ,"The system architecture involves the integration of multi-agent simulation, system dynamics, complex networks, and cellular automata methods to model complex systems in library and information science. It includes various research fields such as information dissemination, knowledge management, scientific evaluation, and competitive intelligence, and is supported by big data and metaverse technologies.","Agents in the system can represent various entities such as individuals, organizations, and information systems in the library and information science domain, interacting and influencing each other within the modeled environments.","The behavior mechanism combines multi-agent simulation for modeling individual and group behaviors, system dynamics for analyzing feedback loops and nonlinear relationships, complex networks for representing structural connections, and cellular automata for simulating spatial-temporal evolutions. These methods are used to study information broadcasting，knowledge management, and other processes.","The evaluation method adopts a systematic review of relevant literature, analyzing the application status and characteristics of different simulation methods in library and information science, and discussing their application prospects in combination with new technologies.","The experimental design includes fuzzy retrieval and manual annotation of literatures, screening and classification of simulation methods, and case analysis of application scenarios in different research fields.","The challenges include the high abstraction degree of simulation models, limited research topics, and the need to integrate new technologies like big data and metaverse to address complex problems in the discipline.","The research gap lies in the insufficient depth of current simulations, lack of comprehensive modeling for complex phenomena, and limited application scope of simulation methods in library and information science.",The evaluation limitations include potential uncertainties in model parameters and the need for further validation and improvement of simulation results in practical applications.,"Wu Jiang, Huang Xiao, Zhu Hou, He Chaocheng",2022,KNOWLEDGE OF LIBRARY AND INFORMATION SCIENCE,Journal article
"60","The 3rd International Workshop on Deep Learning for the Web of Things","Deep learning and the Web of Things (WoT) have become powerful tools for web engineering, leading to increased investigation and publication of research related to deep learning in web engineering. Therefore, this workshop is titled 'The 3rd International Workshop on Deep Learning for the Web of Things' for the Web Conference 2023 (WWW’23). This workshop features five research articles: (1) 'Multiple-Agent Deep Reinforcement Learning for Avatar Migration in Vehicular Metaverses', (2) 'Web 3.0: Future of the Internet', (3) 'Weighted Statistically Significant Pattern Mining', (4) 'DSNet: Efficient Lightweight Model for Video Salient Object Detection for IoT and WoT Applications', and (5) 'The Human-Centric Metaverse: A Survey'.","Deep Learning, Web of Things, Machine learning, Internet of Things",Web of Things Platform,IOT,"The system architecture involves integrating deep learning with the Web of Things, covering areas like vehicular metaverses, Web 3.0, pattern mining, video object detection, and human-centric metaverse.","Agents include avatars in vehicular metaverses, users in Web 3.0, and entities involved in pattern mining and object detection.","The behavior mechanism utilizes multi-agent deep reinforcement learning for avatar migration, weighted pattern mining algorithms, deformable separable networks for video detection, and surveys for human-centric metaverse analysis.","Evaluation methods include reviewer scoring for best paper selection, algorithm efficiency analysis, and survey-based technology overviews.","Experimental design includes case studies on avatar migration, Web 3.0 technology analysis, pattern mining algorithm testing, and video object detection model implementation.","Challenges include optimizing deep learning models for WoT efficiency, integrating Web 3.0 technologies, and addressing human-centric metaverse design.","Research gaps involve enhancing real-time performance of deep learning in WoT, improving Web 3.0 scalability, and developing comprehensive human-centric metaverse frameworks.",Evaluation limitations include limited case studies and reliance on reviewer subjective scoring.,"Cheng Shi, Chin-Chen Chang, Eyhab Al-Masri, Abel C. H. Chen, Haishuai Wang, Qichun Zhang, Hsiao-Ting Tseng, K. Shankar, Taehong Kim",2023,Companion Proceedings of the ACM Web Conference 2023,Workshop Paper
"61","Understanding the Interplay of Model Complexity and Fidelity in Multiagent Systems via an Evolutionary Framework","Modern video games come with highly realistic graphics enabling the players to interact with visually rich virtual worlds. Realistic (life-like) animation of nonplayer characters (NPCs) in such virtual worlds is particularly important to enhance the gaming experience. Multiagent systems are one effective approach to synthesize life-like behaviors and interactions by codifying simple rules into NPCs (each NPC as an autonomous agent). However, such behaviors generally come at the cost of increasing computational expense and complexity in terms of aspects such as number of rules and parameters. Therefore, the desire for high fidelity (highly realistic) behaviors is often in conflict with the drive for low complexity. Multiobjective evolutionary algorithms provide a sophisticated mechanism to optimize two or more conflicting objectives simultaneously. However, evolutionary computing techniques need an appropriate objective function to drive the exploration in the correct direction. Pairing of evolutionary techniques and multiagent systems is challenging in the classes of problems in which the fitness is evaluated based on human aesthetic judgment rather than on objective forms of measurements. In this study, we present a multiobjective evolutionary framework to evolve low complexity and high fidelity multiagent systems by utilizing a machine learning system trained by bootstrapping human aesthetic judgment. We have gathered empirical data in three problem areas—simulation of conversational group dynamics, sheepdog herding behaviors, and traffic dynamics, and show the effectiveness of our approach in deriving low complexity and high fidelity multiagent systems. Further, we have identified common properties of the Pareto-optimal frontiers in the three problem areas that can ultimately lead to an understanding of a relationship between simulation model complexity and behavior fidelity. This understanding will be useful in deciding which level of behavioral fidelity is required for the characters in video games based on the distance to the camera, importance to the scene, and available computational resources.","Complexity, fidelity, level of detail artificial intelligence (LOD AI), multiagent systems, multiobjective optimization",Video Game and Simulation Platform,"Video Game, multiagent systems","The system architecture involves multiagent systems with three problem domains: conversational group dynamics, sheepdog herding behaviors, and traffic dynamics. It uses a multiobjective evolutionary framework with machine learning trained on human aesthetic judgment to balance model complexity and fidelity.","Agents include nonplayer characters (NPCs) in virtual environments, such as conversational group members, sheep, a herding dog, and vehicles, each following rule-based behaviors.","The behavior mechanism uses multiobjective evolutionary algorithms (NSGA-II) to optimize for low complexity and high fidelity. Rules and parameters for agents are evolved, with complexity measured by rule count, parameter count, and cyclomatic complexity. Fidelity is evaluated via a machine learning system trained on human judgments of behavior realism.","Empirical data collection in three problem domains, using machine learning systems trained on human ratings for fidelity. Pareto-optimal frontiers analysis for complexity-fidelity tradeoffs, hypervolume calculation for solution set evaluation.","Three multiagent scenarios: conversational group dynamics, sheepdog herding, and lane merge traffic. Evolutionary runs with NSGA-II, varying complexity measures (rule count, parameter count, CC-L1, CC-L2), 5 runs per measure, 100 generations.","Balancing high behavioral fidelity with low computational complexity in multiagent systems, evaluating fidelity based on subjective human judgment, and generalizing findings across different problem domains.","Limited understanding of the relationship between model complexity and fidelity in multiagent systems, lack of automated methods for fidelity evaluation based on human perception, and need for common frameworks across diverse scenarios.","Fidelity evaluation relies on human judgment, which is subjective. The study's complexity measures may not capture all aspects of model complexity, and results are validated in specific scenarios.","Erandi Lakshika, Michael Barlow, Adam Easton",2017,IEEE Transactions on Computational Intelligence and AI in Games,Journal article
