ID,Title,Abstract,Keywords,Platform_Type,Research_Area,System_Architecture,Agent_Role,Behavior_Mechanism,Evaluation_Method,Experimental_Design,Challenge_Type,Research_Gap,Evaluation_Limitations,Authors,Year,Source_Name,Publication_Type
"37","Multi-Agent Deep Reinforcement Learning for Digital Twin over 6G Wireless Communication in the Metaverse","Technology advancements in wireless communications and high-performance Extended Reality (XR) have empowered the developments of the Metaverse. The demand for Metaverse applications and hence, real-time digital twinning of real-world scenes is increasing. Nevertheless, the replication of 2D physical world images into 3D virtual world scenes is computationally intensive and requires computation offloading. The disparity in transmitted scene dimension (2D as opposed to 3D) leads to asymmetric data sizes in uplink (UL) and downlink (DL). To ensure the reliability and low latency of the system, we consider an asynchronous joint UL-DL scenario where the smaller data size of the physical world scenes captured in the UL will be uploaded to the Metaverse Console (MC) to be construed and rendered, and the larger-size 3D virtual world scenes need to be transmitted back in DL. The decisions pertaining to computation offloading and channel assignment are optimized in the UL stage, and the MC will optimize power allocation for users assigned with a channel in the UL transmission stage. To ensure the reliability and low latency of the system, we design a novel Multi-agent Deep Reinforcement Learning (MADRL) structure, namely Asynchronous Actors Hybrid Critic (AAHC). The simulation experiments demonstrate that compared to the proposed baselines, AAHC obtains better solutions with a preferable training time.","Reinforcement learning, resource allocation, latency, reliability, wireless communications, Metaverse","6G Wireless Communication Platform","Multi-Agent Deep Reinforcement Learning for Digital Twin in Metaverse over 6G Wireless Communication","The system architecture includes an asynchronous joint UL-DL scenario with two agents: UL Agent (Agent 1) for computation offloading and channel assignment, and DL Agent (Agent 2) for power allocation. It utilizes the Asynchronous Actors Hybrid Critic (AAHC) algorithm with a hybrid critic network.","Agent 1 (UL Agent) optimizes computation offloading and channel assignment for XR users. Agent 2 (DL Agent) optimizes downlink power allocation for users assigned a channel in the UL stage.","The behavior mechanism uses the AAHC algorithm, a novel Multi-agent Deep Reinforcement Learning (MADRL) structure. It employs two asynchronous actors (for UL and DL) and a hybrid critic to handle sequential decision-making, with stage-specific and global rewards.","Simulation experiments comparing AAHC with baselines (IteRL, CRL, Random Allocation) using metrics like global reward, total delay, re-transmission times, and uplink rate.","Simulations in scenarios with 3 channels and 4-7 XR users. Bandwidth set to 10GHz, data translation function simulated with random scaling, channel gains following Rayleigh distribution.","Ensuring reliability and low latency in asynchronous UL-DL transmissions for real-time digital twinning in Metaverse, addressing asymmetric data sizes and interference.","Limited research on joint optimization of computation offloading, channel assignment, and power allocation in asynchronous UL-DL scenarios for Metaverse digital twinning.","The model assumes fixed UL and DL times, and the data translation function is simulated with uniform sampling, which may not fully reflect real-world complexities.","Wenhan Yu, Terence Chua Jie, Jun Zhao","2023","2023 IEEE Conference on Computer Communications Workshops (INFOCOM WKSHPS)","Conference article"
"38","Multiagent Deep Reinforcement Learning for Dynamic Avatar Migration in AIoT-Enabled Vehicular Metaverses With Trajectory Prediction","This article proposes a dynamic avatar task migration framework for AIoT-enabled vehicular metaverses (AeVeM) to minimize latency and enhance user immersive experiences. The framework combines a coverage-aware LSTM trajectory prediction model with a Hybrid-MAPPO algorithm to address challenges like high mobility of vehicles, dynamic RSU workloads, and nonuniform RSU deployment.","Artificial Intelligence of Things (AIoT), avatar, Metaverses, multiagent deep reinforcement learning (MADRL), service migration, trajectory prediction","Vehicular Metaverse","Edge Computing, Reinforcement Learning, IoT","Decentralized Multiagent System","Intelligent Vehicles, RSUs","Hybrid continuous and discrete action spaces, POMDP","Numerical simulations, MSE, R2 score, MAE, MedAE","Urban scenario with 10 vehicles and 6 RSUs, varying task sizes, bandwidths, and computing resources","Resource-intensive tasks, dynamic RSU workload, nonuniform RSU deployment","Existing works did not address heterogeneous RSU deployment and the impact of vehicle mobility on avatar migration.","Limited to simulation-based evaluation; real-world deployment challenges not addressed.","Junlong Chen, Jiawen Kang, Minrui Xu, Zehui Xiong, Dusit Niyato, Abbas Jamalipour, Shengli Xie","2024","IEEE Internet of Things Journal","Journal Article"
"39","Mobile Edge Adversarial Detection for Digital Twinning to the Metaverse: A Deep Reinforcement Learning Approach","Digital Twinning of physical world scenes onto the Metaverse is necessary for augmented reality (AR)-assisted driving. In AR-assisted driving, physical environment scenes are first captured by AR vehicles and are uploaded to the Metaverse for the construction of the Metaverse Map. However, the development of AR-assisted driving applications invites adversaries. These attackers may place adversarial patches on physical objects, seeking to contort the Metaverse Map. As real-time, accurate detection of adversarial patches is compute-intensive, these physical world scenes have to be offloaded to the Metaverse Map Base Station (MMBS) for computation. Therefore, we considered a scenario where AR vehicles capture physical world scenes and upload these scenes in real-time to the MMBSs. We formulated an optimization problem where the MMSP’s objective is to maximize adversarial patch detection mean Average Precision (mAP), while minimizing the computed AR scene uplink transmission latency and minimizing the worst-case (largest) AR vehicle’s uplink transmission battery charge consumption, through optimizing the AR vehicle-MMBS allocation, AR vehicle uplink scene resolution selection, and AR vehicle uplink power output selection. We proposed a Heterogeneous Action (HA) algorithm to tackle the proposed problem. Extensive experiments show our HA models outperforms baseline models when compared against key metrics.","Metaverse, resource allocation, reinforcement learning, augmented reality, digital twin","6G Wireless Communication Platform","Mobile edge adversarial detection for digital twinning to the Metaverse using deep reinforcement learning","The system architecture includes AR vehicles capturing physical world scenes and uploading them to MMBSs. It features three RL agents: Agent1 for MMBS allocation, Agent2 for resolution selection, and Agent3 for power allocation, using the Heterogeneous Action (HA) algorithm.","Agent1 handles discrete MMBS allocation, Agent2 selects continuous resolution values, and Agent3 chooses continuous uplink power outputs, all working to optimize mAP, latency, and battery consumption.","The behavior mechanism uses the Heterogeneous Action Proximal Policy Optimization (HAPPO) algorithm, with three agents having distinct roles and reward functions, and a hybrid critic for personalized advantage calculations.","Simulation experiments comparing HA models (HAPPO, HAA2C) with baselines (IDA, CTDE) using metrics like mAP, uplink delay, and battery consumption.","Experiments with 4 MMBS and 7-10 AR vehicles, varying bandwidth, power, resolution, and mobility. Training for 1,000,000 steps with ADAM optimizer and random seeds.","Real-time detection of adversarial patches in AR-assisted driving, optimizing resource allocation for low latency and energy efficiency, and handling mobile edge computing inefficiencies.","Limited research on joint optimization of MMBS allocation, resolution, and power for adversarial detection in dynamic Metaverse environments with mobile AR vehicles.","The model assumes uniform mobility and fixed parameters, which may not fully reflect real-world AR vehicle behavior and environmental complexities.","Terence Jie Chua, Wenhan Yu, Jun Zhao","2023","IEEE Transactions on Wireless Communications","Journal article"
"40","Multiple-Agent Deep Reinforcement Learning for Avatar Migration in Vehicular Metaverses","This paper proposes a dynamic avatar task migration framework for vehicular Metaverses, leveraging blockchain-based Web 3.0 for secure data management. The framework uses a Multi-Agent Deep Reinforcement Learning (MADRL) algorithm to optimize migration decisions, minimizing latency while ensuring continuous and immersive avatar services.","vehicular Metaverse, avatar migration, multi-agent deep reinforcement learning","Vehicular Metaverse","Edge Computing, Reinforcement Learning, Blockchain","Decentralized Multiagent System","Intelligent Vehicles, RSUs","Binary pre-migration decisions, POMDP","Numerical simulations, reward comparison, latency analysis","Urban scenario with 12 vehicles and 3 RSUs, varying task sizes and bandwidths","Task pre-migration decisions, edge server overload","Existing works did not integrate blockchain for secure data management or address dynamic edge server loads effectively.","Limited to simulation-based evaluation; real-world scalability and security challenges not fully addressed.","Junlong Chen, Jiangtian Nie, Minrui Xu, Lingjuan Lyu, Zehui Xiong, Jiawen Kang, Yongju Tong, Wenchao Jiang","2023","Companion Proceedings of the ACM Web Conference 2023 (WWW '23 Companion)","Conference Paper"
"41","On a Cooperative Deep Reinforcement Learning-Based Multi-Objective Routing Strategy for Diversified 6G Metaverse Services","Metaverse has been widely recognized as an important 6G application with increasingly stringent, detailed, and diversified requirements for multiple Quality of Service (QoS) metrics. However, traditional routing strategies are usually based on unified weights and select the paths independently, which neglects the service diversity and resource constraints. In this paper, we focus on the diversified metaverse service requirements and propose the Deep Reinforcement Learning (DRL) based multiple objective routing strategy for different services. Multiple agents in the DRL model cooperatively select the paths to improve the resource utilization efficiency. Simulation results illustrate that our proposal outperforms traditional strategies.","6G metaverse services, diversified QoS requirements, multi-objective routing, cooperative deep reinforcement learning","6G Network Platform","Multi-objective routing strategy for diversified 6G metaverse services using cooperative deep reinforcement learning","The system architecture is modeled as a wireless mesh network (WMN) represented by an undirected graph \(G(V, E)\), with edge servers near routers. It uses a Decentralized Partially Observable MDP (Dec-POMDP) framework.","Agents are responsible for end-to-end (E2E) path selection for specific services, each making routing decisions based on neighbor router states.","The behavior mechanism uses a Multi-Agent Deep Q-Network (MA-DQN) algorithm with a cooperation mechanism. It models the problem as a Dec-POMDP, where agents share rewards and cooperate to optimize paths for diversified services.","Simulation experiments comparing MA-DQN with DQN, Multi-Type Open Shortest Path First (MT-OSPF), and Routing Information Protocol (RIP) using metrics like rewards, average packet delay, packet drop rate, and network throughput.","Simulations use a network topology with 11 router nodes, 14 links, packet sending rate of 1.5 Gbps, and transmission rate of 5 Gbps. Weights for QoS metrics are set for latency-sensitive, high-reliability, and throughput-sensitive services.","Meeting diversified and stringent QoS requirements for multiple metrics (latency, packet drop rate, throughput) in 6G metaverse services and optimizing resource utilization.","Traditional routing strategies neglect service diversity and resource constraints, and existing methods often use unified paths or single metrics, failing to address diversified QoS needs.","The evaluation focuses on a specific network topology and may not fully account for all real-world 6G network complexities or dynamic service changes.","Bomin Mao, Xueming Zhou, Jiajia Liu, Nei Kato","2024","IEEE Transactions on Vehicular Technology","Journal article"
"42","On a Hierarchical Content Caching and Asynchronous Updating Scheme for Non-Terrestrial Network-Assisted Connected Automated Vehicles","This paper proposes a hierarchical content caching and asynchronous updating scheme for Non-Terrestrial Networks (NTNs) to optimize content delivery for Connected Automated Vehicles (CAVs). The scheme includes a Delay-Motivated Ant Colony Optimization (DM-ACO) algorithm for caching node selection and a Multi-Agent Deep Reinforcement Learning-based Hierarchical Caching and Asynchronous Updating (MADRL-HCAU) strategy to minimize transmission delay and improve cache hit ratio.","Non-terrestrial networks, hierarchical caching, asynchronous updating, ant colony optimization, multi-agent deep reinforcement learning","Non-Terrestrial Networks (NTNs)","Edge Computing, Reinforcement Learning, IoT","Hierarchical Multi-Layer System","LEO Satellites, UAVs","DM-ACO for node selection, MADRL-HCAU for caching decisions","Numerical simulations, cache hit ratio, packet drop rate, content updating delay","Simulated urban scenario with 12 vehicles and 3 edge servers, varying content sizes and request frequencies","Heterogeneous caching hardware, dynamic network environments, content duplication","Existing works lack integration of cross-layer caching and asynchronous updating for NTNs.","Simulation-based; real-world deployment challenges not addressed.","Bomin Mao, Yangbo Liu, Hongzhi Guo, Yijie Xun, Jiadai Wang, Jiajia Liu, Nei Kato","2024","IEEE Journal on Selected Areas in Communications","Journal Article"
43,"QoE-Oriented Cooperative VR Rendering and Dynamic Resource Leasing in Metaverse","The rise of the Metaverse has ushered in a new era of social networking, offering users deeply engaging spaces to connect and participate in social activities. However, rendering these virtual environments is resource-intensive. With many users accessing simultaneously and requiring diverse Metaverse services, optimizing Metaverse resources to deliver the best quality-of-experience (QoE) for users is a significant challenge. In this paper, we propose a cooperative virtual reality (VR) rendering and dynamic resource leasing mechanism to address this issue. Specifically, we first introduce a cooperative VR scene pre-rendering framework between users and Planets (i.e., edge servers hosting users), and establish a new user QoE metric named EdgeVRQoE which considers both rendering delay and visual quality. We formulate the multidimensional rendering resources (e.g., GPU, CPU, and outbound bandwidth) leasing problem between Planets and users as a double-layer decision problem, and devise a hybrid action multi-agent reinforcement learning-based dynamic resource auction mechanism to efficiently allocate limited resources of Planets in a distributed and adaptive manner. Extensive simulations demonstrate that our proposed scheme outperforms the representatives in user QoE and resource utilization efficiency. Particularly, the proposed scheme shows at least an 18-fold improvement in QoE over other schemes, demonstrating its capability in providing immersive Metaverse experiences.","Metaverse, cooperative VR rendering, QoE, MARL, dynamic resource leasing","Metaverse Network Platform","QoE-oriented cooperative VR rendering and dynamic resource leasing in Metaverse","The system architecture is a three-layer cloud-edge-end collaborative Metaverse network, including a central Nebula server, edge servers (Planets), and user terminals. It uses a Decentralized Partially Observable Markov Decision Process (Dec-POMDP) framework.","Users act as bidders leasing rendering resources, and Planets act as auctioneers pricing and allocating resources. Users decide which Planet to access and resource quantities, while Planets set resource prices.","The behavior mechanism uses the MA-HyAR-TD3 algorithm, a hybrid action multi-agent reinforcement learning approach. It constructs a latent representation space for discrete-continuous hybrid actions and uses twin-delayed deep deterministic policy gradient for training.","Simulation experiments comparing MA-HyAR-TD3 with baselines (MA-PA-DDPG, MA-PA-Delayed-DDPG, MA-PA-TD3, Random scheme) using metrics like average reward, EdgeVRQoE, pre-rendering success percentage, and resource utilization.","Experiments with 1 Nebula server, 3 Planets, 5 users; network distances [10,100]; 30 virtual object types; resource capacities varying. Trained with Adam optimizer, evaluated over 100 episodes.","Balancing visual quality and rendering delay, handling distributed discrete-continuous hybrid decision-making, and adapting to dynamic Metaverse environments.","Existing methods lack efficient handling of discrete-continuous hybrid actions and comprehensive QoE models integrating delay and visual quality for multi-user Metaverse scenarios.","The evaluation focuses on a specific number of users and Planets, and may not fully reflect extremely large-scale Metaverse environments or all service types.","Nan Liu, Tom H. Luan, Yuntao Wang, Yiliang Liu, Zhou Su","2025","IEEE Transactions on Mobile Computing","Journal article"
"44","QoI-Aware Mobile Crowdsensing for Metaverse by Multi-Agent Deep Reinforcement Learning","Metaverse is expected to provide mobile users with emerging applications both in regular situations like intelligent transportation services and in emergencies like wireless search and disaster response. These applications are usually associated with stringent quality-of-information (QoI) requirements like throughput and age-of-information (AoI), which can be further guaranteed by using unmanned aerial vehicles (UAVs) as aerial base stations (BSs) to compensate the existing 5G infrastructures. In this paper, we consider a new QoI-aware mobile crowdsensing (MCS) campaign by UAVs which move around and collect data from mobile users wearing metaverse devices. Specifically, we propose 'MetaCS', a multi-agent deep reinforcement learning (MADRL) framework with improvements on a Transformer-based user mobility prediction module between regions and a relational graph learning mechanism to enable the selection of most informative partners to communicate for each UAV. Extensive results and trajectory visualizations on three real mobility datasets in NCSU, KAIST and Beijing show that MetaCS consistently outperforms six baselines in terms of overall QoI index, when varying different numbers of UAVs, throughput requirement, and AoI threshold.","Mobile crowdsensing for metaverse, quality-of-information, user behavior modeling, multi-agent deep reinforcement learning","UAV-assisted MCS","Metaverse, Mobile Crowdsensing, Multi-Agent Systems","Decentralized Partially Observable Markov Decision Process (Dec-POMDP)","UAVs as mobile aerial BSs","Transformer-based user mobility prediction, relational graph learning","Overall QoI index, throughput satisfactory ratio, AoI satisfactory ratio, episodic AoI","Three real-world mobility datasets (NCSU, KAIST, Beijing), hyperparameter tuning, ablation study, performance comparison with six baselines","Balancing UAV movements for data collection, saving battery power, maintaining QoI for all users","Existing approaches seldom consider suitable collaborative control mechanism among UAVs and accurate prediction of the spatial-temporal user distribution","Computational complexity increases with task duration and number of UAVs","Yuxiao Ye, Hao Wang, Chi Harold Liu, Zipeng Dai, Guozheng Li, Guoren Wang, Jian Tang","2023","IEEE Journal on Selected Areas in Communications","Journal Article"
"45","Resource Allocation and QoE Maximization in Aerial MEC-empowered Metaverse Service: A CCM-Multi-agent DRL approach","The integration of Mobile Edge Computing (MEC) with aerial platforms introduces novel potential for the Metaverse world by providing low-latency and highly reliable computing and communication services at the network edge. Nevertheless, this integration presents critical challenges, such as low Quality of Experience (QoE) due to the dynamic nature of aerial platforms, high resource demands, and the requirements for real-time data processing in the Metaverse environment. To address these challenges, we propose a Combinatorial Client-Master Multiagent Deep Reinforcement Learning (CCM-MADRL) based joint resource allocation and QoE maximization framework to enable intelligent real-time decision-making in aerial MEC enabled Metaverse services. We form a collaborative ecosystem where agents are designed to represent both Metaverse service providers and aerial platforms to promote fairness and efficiency in resource allocation, as well as optimize service delivery. By incorporating CCM, our approach considers diverse metrics, such as latency, reliability, meta-distance, and energy efficiency, to ensure a holistic optimization of Metaverse services. The MADRL approach enables adaptive decision-making, allowing the system to respond to the dynamic and unpredictable nature of Metaverse applications. Results from simulations that mimic realistic Metaverse scenarios demonstrate the effectiveness of the proposed CCM-MADRL framework in terms of improved service performance, reduced latency, cost, and virtual meta-distance, maximized average QoE utility of Metaverse users, and enhanced resource utilization compared to baseline algorithms.","CCM-MADRL, meta-distance, Metaverse, Quality of experience, Resource allocation","Aerial MEC and Terrestrial Network Platform","Aerial MEC-empowered Metaverse service architecture with Terrestrial and Non-Terrestrial Networks (TN-NTN), including aerial base stations (UCH, HAPs), Metaverse users (MUs), and Metaverse service providers (MSPs).","Client agents represent MUs, deciding MSP selection and resource requests; master agents represent MSPs and aerial platforms, allocating resources and optimizing service delivery.","Combinatorial Client-Master Multiagent Deep Reinforcement Learning (CCM-MADRL) framework, integrating combinatorial optimization with MADRL for adaptive resource allocation and QoE maximization.","Simulation experiments comparing CCM-MADRL with baseline algorithms (MADDPG, DDPG) using metrics like QoE utility, meta-distance, latency, and resource utilization.","Simulated TN-NTN environment with 90 MUs, 3 MSPs, 20 subchannels per ABS; parameters include computation capacity [20,200] GHZ, meta-data size [10,200] MB, and transmission power settings.","The experimental design simulates a TN-NTN environment with 90 MUs, 3 MSPs, and 20 subchannels per ABS, using 2000 training episodes, comparing against MADDPG and DDPG to evaluate QoE utility, meta-distance, and latency.","Dynamic resource allocation in aerial MEC due to platform mobility, high resource demands for Metaverse services, and real-time data processing requirements.","Limited research on hierarchical, multi-domain resource allocation and MSP selection for TN-NTN integrated Metaverse services with dynamic environments.","Simulations focus on specific scenarios with defined MU and MSP numbers, potentially not capturing extrame edge cases or large-scale deployments.","Abegaz Mohammed Seid, Hayla Nahom Abishu, Gordon Owusu Boateng, Aiman Erbad, Mounir Hamdi, Mohsen Guizani",2024,2024 IEEE Global Communications Conference (GLOBECOM),Conference article
