ID,Title,Abstract,Keywords,Platform_Type,Research_Area,System_Architecture,Agent_Role,Behavior_Mechanism,Evaluation_Method,Experimental_Design,Challenge_Type,Research_Gap,Evaluation_Limitations,Authors,Year,Source_Name,Publication_Type
"20","Dynamic Resource Scheduling for Air-Ground Collaborative Communication: A Hierarchical Multi-Agent Method for Metaverse","With the rapid advancement of 5G communication and the Internet of Things (IoT), unmanned aerial vehicles (UAVs) has shown its potential to play a pivotal role as aerial base stations within the evolving landscape of future wireless networks and edge computing systems. However, in such UAV-assisted communication networks, the complexity of multi-agent scenarios creates challenges due to the problem of learning and decision-making in complex tasks. To address this issue, we propose a novel algorithm that optimizes UAV trajectory planning and autonomous clustering of user equipment (UE) for communication. The proposed algorithm leverages hierarchical reinforcement learning and multi-agent cognitive consistency to improve UE communication decisions in interference-prone environments. Simulation results confirm the convergence of the proposed algorithm and reveal special strength in coordinating spectrum utilization in complex air-ground environments.","unmanned aerial vehicle (UAV), relay communication, hierarchical reinforcement learning, multi-agent, graph convolutional networks, spectrum allocation","UAV-assisted communication networks","Resource Scheduling, Air-Ground Collaboration, Anti-Interference Communication","Three-layer hierarchical structure: UAV and user cluster association, UAV trajectory planning, and UE communication decision-making","UAVs as aerial relays, UEs as communication agents","Hierarchical Multi-Agent Autonomous Clustering Decision (HMACD) algorithm combining GCN and k-means clustering","Simulation","Comparison with methods without autonomous clustering","Learning and decision-making in complex multi-agent scenarios, interference mitigation","Existing works optimize resource allocation and interference mitigation separately","Simulation-based evaluation may not fully capture real-world dynamic interference scenarios","Hanyi Li, Yang Huang, Runhe Wang, Miaomiao Dong","2023","The 20th International Wireless Communications & Mobile Computing Conference","Conference Paper"
"21","Enhancing Computational Processing Performance for Generative AI Large Models with Autonomous Decision-Making in Metaverse Applications","We explore how to enhance the computational processing performance for generative AI large models with autonomous decision-making in metaverse applications. We first introduce the relationship between AI large models and the Metaverse. We elaborate on the application scenarios of generative AI large models in Metaverse, including real-time weather simulation, embodied intelligence of agents, dynamic environment interaction, and user emotion recognition. We then propose the method of Multi-Dimensional Optimization Generation Framework (MDOGF) to improve computational processing performance. The experiment results show great improvement in computational processing performance.","Generative AI Large Models, Metaverse, Autonomous Decision-Making, Reinforcement Learning, MultiAgent Systems, Model Compression, Model Acceleration, MultiModal Data Integration, Digital Twin Technology, AGI (Artificial General Intelligence)","Metaverse Application Platform","Enhancement of computational processing performance for generative AI large models in metaverse applications","The system architecture includes the Multi-Dimensional Optimization Generation Framework (MDOGF), which combines world large models, AGI technology, Q* technology, efficient model compression and acceleration, and multi-view diffusion with multi-scale resolution enhancement. It also integrates GIS data and physics engines.","Agents in the metaverse, such as virtual guides and teachers, perform autonomous decision-making and interaction based on user needs and environmental changes, with roles including environmental perception, path planning, and service provision.","The MDOGF framework uses world large models for environment simulation, AGI technology for autonomous decision-making, Q* technology for multi-step reasoning, and model compression/acceleration techniques to improve computational efficiency. It also employs multi-view diffusion and multi-scale resolution enhancement for high-precision 3D modeling.","Simulation experiments and comparative analysis, evaluating performance using metrics such as accuracy, precision, recall, F1-score, frame rate, latency, and processing efficiency.","Experiments conducted on real-time weather simulation, embodied intelligence of agents, multi-modal data integration, and digital twin technology, using datasets A and B with specific model parameter settings.","High computational complexity of generative AI large models, real-time processing requirements, and ensuring seamless interaction and decision-making in dynamic metaverse environments.","Existing methods lack efficient multi-dimensional optimization frameworks for enhancing computational performance of generative AI large models in metaverse applications, and there is a gap in integrating autonomous decision-making with complex environment simulation.","The evaluation is based on specific datasets and simulation scenarios, and the performance in extremely large-scale and highly complex real-world metaverse environments remains to be verified.","Pengyong Ding, Jiarong Liu, Min Sun, Li Li, Hong Liu","2024","2024 IEEE International Conference on Metaverse Computing, Networking, and Applications (MetaCom)","Conference article"
"22","Efficient Twin Migration in Vehicular Metaverses: Multi-Agent Split Deep Reinforcement Learning with Spatio-Temporal Trajectory Generation","Vehicle Twins (VTs) as digital representations of vehicles can provide users with immersive experiences in vehicular metaverse applications, e.g., Augmented Reality (AR) navigation and embodied intelligence. VT migration is an effective way that migrates the VT when the locations of physical entities keep changing to maintain seamless immersive VT services. However, an efficient VT migration is challenging due to the rapid movement of vehicles, dynamic workloads of Roadside Units (RSUs), and heterogeneous resources of the RSUs. To achieve efficient migration decisions and a minimum latency for the VT migration, we propose a multi-agent split Deep Reinforcement Learning (DRL) framework combined with spatio-temporal trajectory generation.","Digital Twins, service migration, deep reinforcement learning, vehicular metaverse","Vehicular Metaverse","VT Migration, Resource Optimization, Trajectory Generation","Multi-agent split DRL framework with spatio-temporal trajectory generation","Vehicles and RSUs as decentralized agents","Multi-Agent Split Reinforcement Learning (MSRL) with adaptive switching between client-side and server-side models","Simulation and numerical analysis","Comparison with Local-Edge Model, Local-Model, Full Migration, and Random Migration baselines","Dynamic network conditions, computational demands, privacy concerns","Existing methods lack adaptability to real-time changes and efficient resource utilization","Simulation may not fully capture real-world network dynamics","Junlong Chen, Jiawen Kang, Minrui Xu, Fan Wu, Hongliang Zhang, Huawei Huang, Dusit Niyato, Shiwen Mao","2023","IEEE Conference Paper","Conference Paper"
"23","Environmental Cognition-Driven Hierarchical Decision-Making for Air-Ground Collaborative Communication","The unparalleled communication and sensing capabilities of the 6th generation (6G) networks can fulfill the diverse requirements of emerging scenarios like the metaverse. However, several issues such as queue transmission between numerous heterogeneous nodes and difficulties in understanding complex and dynamic environments from high-level cognition urgently need to be addressed. In response, this paper proposes an environmental cognition-driven method based on graph convolutional networks (GCNs), which comprehensively considers node positions, task queues, and frequency conflicts, then optimizing node clustering to cope with complex and dynamic electromagnetic environments. In the meanwhile, to overcome the limitations of conventional reinforcement learning (RL) methods in addressing the increasing complexities of multi-task and multi-granularity decision-making, a hierarchical reinforcement learning (HRL) method based on the actor-critic (AC) framework is proposed to quick decisionmaking for air-ground collaborative communication. Numerical results demonstrate that the proposed environmental cognitiondriven hierarchical decision-making method can reduce redundant interactions among nodes and improve the transmission rate.","environmental cognition-driven, air-ground collaborative communication, hierarchical reinforcement learning, graph convolutional network, multi-agent spectrum allocation","6G Network","Air-ground collaborative communication in complex urban environments for 6G networks","The system architecture includes three layers: ground node communication decision-making layer, UAV trajectory planning layer, and cluster association decision-making layer. It utilizes GCN for environmental cognition and HRL based on AC framework for hierarchical decision-making.","UAVs and ground nodes act as agents. UAVs provide dynamic network deployment and task queue offloading, while ground nodes generate and transmit queues. Clusters of ground nodes and UAVs collaborate for efficient communication.","The method uses GCN to aggregate node features for clustering, considering building occlusion, node positions, task queues, and frequency relationships. HRL based on AC framework is employed for hierarchical decision-making, decomposing complex tasks into sub-tasks to reduce state and action space complexity.","Numerical simulations and comparative analysis, evaluating performance by measuring accumulated queues of UAVs and ground nodes, and comparing results with and without environmental cognition.","Simulations conducted with three clusters of ground nodes, three UAVs, and a jammer in a complex urban environment. Parameters include UAV altitude, movement speed, ground node positions, frequency bands, and power configurations.","Queue transmission between heterogeneous nodes, understanding complex dynamic environments from high-level cognition, and addressing multi-task and multi-granularity decision-making complexities.","Existing methods lack efficient environmental cognition-driven hierarchical decision-making frameworks for air-ground collaborative communication in complex urban environments, and conventional RL methods struggle with multi-dimensional decision-making.","Simulations are conducted in a controlled environment with specific configurations, and the method's performance in extremely dynamic and large-scale real-world scenarios remains to be verified.","Runhe Wang, Yang Huang","2024","2024 IEEE/CIC International Conference on Communications in China (ICCC Workshops)","Conference article"
"24","Enabling the Wireless Metaverse via Semantic Multiverse Communication","Metaverse over wireless networks is an emerging use case of the sixth generation (6G) wireless systems, posing unprecedented challenges in terms of its multi-modal data transmissions with stringent latency and reliability requirements. Towards enabling this wireless metaverse, in this article we propose a novel semantic communication (SC) framework by decomposing the metaverse into human/machine agent-specific semantic multiverses (SMs). An SM stored at each agent comprises a semantic encoder and a generator, leveraging recent advances in generative artificial intelligence (AI). To improve communication efficiency, the encoder learns the semantic representations (SRs) of multi-modal data, while the generator learns how to manipulate them for locally rendering scenes and interactions in the metaverse. Since these learned SMs are biased towards local environments, their success hinges on synchronizing heterogeneous SMs in the background while communicating SRs in the foreground, turning the wireless metaverse problem into the problem of semantic multiverse communication (SMC). Based on this SMC architecture, we propose several promising algorithmic and analytic tools for modeling and designing SMC, ranging from distributed learning and multi-agent reinforcement learning (MARL) to signaling games and symbolic AI.","Metaverse, extended reality (XR), semantic communication, signaling game, federated learning, split learning, multi-agent reinforcement learning, symbolic artificial intelligence","Wireless Networks","6G Wireless Systems, Semantic Communication, Generative AI","Semantic Multiverse Communication (SMC) with Semantic Encoder, Generator, and Knowledge Base","Human and Machine Agents","Distributed Learning, MARL, Signaling Games, Symbolic AI","Simulation with MNIST and Fashion MNIST datasets","Toy implementation comparing FL and SL for SMC","Heterogeneous SMs, Latency, Reliability, Multi-modal Data","Lack of interoperability in heterogeneous SMs, High communication overhead","Limited to simulation with simple datasets, Scalability issues with complex environments","Jihong Park, Jinho Choi, Seong-Lyun Kim, Mehdi Bennis","2023","IEEE International Conference on Sensing, Communication, and Networking (SECON)","Conference Paper"
"25","Federated Learning for improved prediction of failures in Autonomous Guided Vehicles","Autonomous Guided Vehicles (AGVs) are nowadays an indispensable component of production lines in smart manufacturing. Managing the fleet of AGVs covers not only the delegation of operational tasks but also the monitoring of AGVs activity and health condition by applying tailored Machine Learning-based methods to detect anomalies in various signals gathered by edge IoT devices mounted on board. Detecting anomalies requires appropriate prediction of selected signals based on multiple types of sensor readings. Momentary energy consumption is one of the signals that can indicate abnormal states in AGVs. In this paper, we show that the prediction of this signal can be improved with the Federated Learning (FL) approach that involves exchanging experience gained by particular AGVs. This paper significantly extends the conference paper (Shubyn et al., 2022) with the new multi-round approach to building global prediction models and recent experiments on real data streams produced by AGVs designed by the AIUT company. The results of our experiments prove that in the AGV operational environments with distributed knowledge Federated Learning performs better than traditional centralized approaches and that frequent synchronization of experience may lead to better prediction quality.","Federated Learning, Autonomous Guided Vehicles, Smart manufacturing, Prediction, Industry 4.0","Smart Manufacturing Platform","Improving failure prediction in Autonomous Guided Vehicles using Federated Learning","The system architecture includes edge IoT devices on AGVs for data collection, an OPC UA Server for data exposure, and a cloud environment with a Cloud Federated Learning module for global model aggregation. It also involves Edge Data Acquisition and Edge Federated Learning modules.","AGVs act as agents that collect sensor data and train local prediction models. The cloud server aggregates these models to form a global model, which is then shared back with AGVs to update their local models.","The behavior mechanism uses Federated Learning with a multi-round approach. Local models on AGVs are trained on sensor data, and then aggregated at a cloud server to create a global model. The global model is used to update local models, improving prediction accuracy over multiple rounds.","Numerical simulations and experiments on real data streams from AGVs, evaluating prediction performance using metrics such as Mean Squared Error (MSE), Mean Absolute Percentage Error (MAPE), and comparing results with traditional centralized approaches.","Experiments conducted using data from AIUT's Formica-1 AGVs, with virtual clients simulating multiple AGVs. Data sets were split into multiple rounds for training and testing, with models evaluated on momentary energy consumption prediction.","Managing distributed knowledge in AGV fleets, improving anomaly detection through accurate signal prediction, and optimizing communication and data exchange between AGVs.","Existing methods lack effective use of distributed learning for AGV failure prediction, and traditional centralized approaches struggle with data privacy and communication overhead in complex manufacturing environments.","The data set used is not publicly available, and the experiments focus on specific AGV models and operational scenarios, limiting generalizability to other environments.","Bohdan Shubyn, Daniel Kostrzewa, Piotr Grzesik, Paweł Benecki, Taras Maksymyuk, Vaidy Sunderam, Jia-Hao Syu, Jerry Chun-Wei Lin, Dariusz Mrozek","2023","Journal of Computational Science","Journal article"
"26","Human-Centric Resource Allocation for the Metaverse With Multiaccess Edge Computing","Multiaccess edge computing (MEC) is a promising solution to the computation-intensive, low-latency rendering tasks of the metaverse. However, how to optimally allocate limited communication and computation resources at the edge to a large number of users in the metaverse is quite challenging. In this article, we propose an adaptive edge resource allocation method based on multiagent soft actor-critic with graph convolutional networks (SAC-GCN). Specifically, SAC-GCN models the multiuser metaverse environment as a graph where each agent is denoted by a node. Each agent learns the interplay between agents by graph convolutional networks with a self-attention mechanism to further determine the resource usage for one user in the metaverse. The effectiveness of SAC-GCN is demonstrated through the analysis of user experience, balance of resource allocation, and resource utilization rate by taking a virtual city park metaverse as an example. Experimental results indicate that SAC-GCN outperforms other resource allocation methods in improving overall user experience, balancing resource allocation, and increasing resource utilization rate by at least 27%, 11%, and 8%, respectively.","Attention mechanism, extended reality (XR), graph convolutional network, multiagent reinforcement learning","Multiaccess Edge Computing (MEC)","Metaverse, Edge Computing, Reinforcement Learning","Thing-edge-cloud collaborative architecture with SAC-GCN","Human and Machine Agents","Multiagent Soft Actor-Critic with Graph Convolutional Networks (SAC-GCN)","Simulation with virtual city park metaverse scenario","Comparison with DQN, ISAC, GCC-G, and BBR-G under varying network conditions","Resource allocation fairness, Latency, Dynamic user demands","The research gap is that existing studies on edge resource allocation for the metaverse either lack consideration of human-centric factors affecting Quality of Experience (QoE) or fail to model the dynamic interactions between multiple users in a collaborative environment. Most prior works focus on single-agent or non-cooperative frameworks, ignoring the complex interdependencies among users and the need for adaptive resource allocation in highly dynamic metaverse scenarios. Additionally, there is a shortage of methods that effectively balance QoE optimization with fair resource distribution, especially in environments with varying network conditions and user demands. The integration of graph-based models to capture spatial-temporal relationships between users in metaverse networks has also been underexplored.","Lack of real-world deployment validation, Limited scalability testing","Zijian Long, Haiwei Dong, Abdulmotaleb El Saddik",2023,IEEE Internet of Things Journal,Journal Article
"27","Hierarchical Deep Reinforcement Learning With Experience Sharing for Metaverse in Education","Metaverse has gained increasing interest in education, with much of literature focusing on its great potential to enhance both individual and social aspects of learning. However, little work has been done to address the systems and technologies behind providing meaningful Metaverse learning. This article proposes a technical framework to address this research gap, where a hierarchical multiagent reinforcement learning approach with experience sharing is developed to augment the intelligence of nonplayer characters in Metaverse learning for personalization. The utility and benefits of the proposed framework and methodologies are demonstrated in Gridlock, a Metaverse learning game, as well as through extensive simulations.","ACP, experience sharing, metaverse learning, reinforcement learning (RL)","Educational Metaverse Platform","Development of hierarchical deep reinforcement learning with experience sharing for Metaverse in education","The system architecture is based on the ACP (Artificial societies, Computational experiments, and Parallel execution) framework, including a high-level agent for task prioritization and multiple low-level agents for specific subtasks, with an experience sharing mechanism between agents.","High-level agent prioritizes learning tasks, low-level agents provide task-specific assistance. NPCs include skilled learner, apprentice learner, and tutor NPCs to interact with learners and personalize learning experiences.","Hierarchical reinforcement learning (HRL) with experience sharing. High-level agent manages task prioritization, low-level agents handle specific tasks. Experience sharing between low-level agents using weighted mutual experience sharing based on similarity metrics.","Numerical simulations and case study in Gridlock, a Metaverse learning game. Evaluated using cumulative reward, steps taken to completion, and comparison with single-agent and other multiagent approaches.","Experimental design includes simulations with binary decision trees to model learner responses, and a case study in Gridlock game with 8 low-level agents. Parameters such as learning rate, discount factors, and batch size are configured as specified in Table I.","Addressing state explosion and convergence time in RL for Metaverse learning, creating effective 'brain' for decision-making in Metaverse, and personalizing learning experiences through NPC interactions.","Lack of technical frameworks and methodologies for meaningful Metaverse learning, especially in designing intelligent NPCs and addressing computational intensity and training time in RL.","The computational experiments are in early stages, and the framework needs validation in more Metaverse learning applications.","Ryan Hare, Ying Tang","2023","IEEE Transactions on Systems, Man, and Cybernetics: Systems","Journal article"
