"ID",Title,"Abstract","Keywords",Platform_Type,Research_Area,System_Architecture,Agent_Role,Behavior_Mechanism,Evaluation_Method,Experimental_Design,Challenge_Type,Research_Gap,Evaluation_Limitations,"Authors","Year",Source_Name,Publication_Type
"66",Multi-Attribute Auction-Based Resource Allocation for Twins Migration in Vehicular Metaverses: A GPT-Based DRL Approach,"Vehicular Metaverses are developed to enhance the modern automotive industry with an immersive and safe experience among connected vehicles and roadside infrastructures, e.g., RoadSide Units (RSUs). For seamless synchronization with virtual spaces, Vehicle Twins (VTs) are constructed as digital representations of physical entities. However, resource-intensive VTs updating and high mobility of vehicles require intensive computation, communication, and storage resources, especially for their migration among RSUs with limited coverages. To address these issues, we propose an attribute-aware auction-based mechanism to optimize resource allocation during VTs migration by considering both price and non-monetary attributes, e.g., location and reputation. In this mechanism, we propose a two-stage matching for vehicular users and Metaverse service providers in multi-attribute resource markets. First, the resource attributes matching algorithm obtains the resource attributes perfect matching, namely, buyers and sellers can participate in a double Dutch auction (DDA). Then, we train a DDA auctioneer using a generative pre-trained transformer (GPT)-based deep reinforcement learning (DRL) algorithm to adjust the auction clocks efficiently during the auction process. We compare the performance of social welfare and auction information exchange costs with state-of-the-art baselines under different settings. Simulation results show that our proposed GPT-based DRL auction schemes have better performance than others.","Vehicular Metaverse, Resource Allocation, Multi-Attribute Auction, GPT-Based DRL, Twin Migration","Simulation Platform","Digital Twin and Metaverse",Metaverse Multi-Layer,"Terminals and Devices",Multi-Agent System,"Quantitative Analysis","Simulation Experiment Design","Metaverse","Scenario Scalability","Scenario","Yongju Tong, Junlong Chen, Minrui Xu, Jiawen Kang, Zehui Xiong, Dust Nyato, Chao Yuan, Zhu Han","2025","IEEE Transactions on Cognitive Communications and Networking","Journal Article"
"67",Multi-Cluster Cooperative Offloading for VR Task: A MARL Approach With Graph Embedding,"Virtual reality (VR) technology has recently achieved notable success and been widely expected to interplay with more mobile multimedia services. To further enhance real-time immersive experience for VR applications, exploiting cooperative offloading among capable terminal devices should be emerged as an effective means. However, faced with diverse and surging mobile VR user requests, terminal-assisted offloading needs to support comprehensive cached content, ultra-low latency delivery, and continuous energy provisioning, to guarantee stringent quality of service requirements, which poses a critical challenge for resource-constrained terminals. Hence, this paper proposes a Cooperative Offloading framework for Terminal Clusters (named CO-TC), in which VR terminal clusters form several cooperation groups for sharing cached field of view (FoV) tiles and available computing resources to cooperatively perform FoV rendering and content delivery. To maximize energy efficiency in CO-TC, an optimization problem is formulated to jointly decide the task offloading and computing resource utilization. An intelligent offloading scheme is designed based on multi-agent reinforcement learning (MARL) specially using agent relation feature graph embeddings. Moreover, we theoretically prove the permutation invariance and convergence of the proposed algorithm and derive the optimal observation range of the agent to balance the performance gain and interaction overhead in the distributed MARL frame. Finally, simulation results show that the proposed offloading scheme outperforms other baselines in terms of VR service performance, including latency, energy consumption, and energy efficiency.","Virtual Reality, Task Offloading, Multi-Cluster Cooperation, Multi-Agent Reinforcement Learning, Graph Embedding","Simulation Platform","Digital Twin and Metaverse",Edge-Cloud Collaboration,"Decision and Management",Multi-Agent System,"Quantitative Analysis",Hybrid Experimental Design,"Computing and Resource Management","Scenario Scalability","Validation Environment","Yang Yang, Lei Feng, Yao Sun, Yangyang Li, Wenjing Li, Muhammad Ali Imran","2024","IEEE Transactions on Mobile Computing","Journal Article"
"68",Multi-User Interaction Experience Optimization in the Metaverse,"The Metaverse is an emerging research and business domain that aims to create a seamless integration of the physical and digital worlds. However, the current network infrastructure poses significant challenges for achieving smooth and immersive interaction in the Metaverse. In this paper, we address the problem of resource management for multi-user interaction experience optimization. We consider a scenario where users generate various types of interaction requests in the Metaverse. The Metaverse service provider (MSP) monitors the requests and accordingly, assigns the resources to the users. To capture the stochastic nature of user requests and the different interaction experience tolerance levels, we propose a novel quality-of-experience (QoE) metric and seek to maximize the user QoE by optimizing resource management. We formulate this problem as a Markov decision process (MDP) with the objective of maximizing the expected long-term user QoE. We further develop a proximal policy optimization (PPO) algorithm to solve the MDP problem. The experimental results show that the obtained PPO algorithm can significantly improve the user QoE in the Metaverse.","Metaverse, Resource Management, Quality of Experience, Reinforcement Learning, Proximal Policy Optimization","Simulation Platform","Multi-Agent System and Reinforcement Learning","Edge-Cloud Collaboration","Decision and Management",Multi-Agent System,"Quantitative Analysis","Simulation Experiment Design","Communication and Network","Models and Algorithms",Scenario,"Zhongxin Cao, Wenqian Zhang, Bo Zhang, Rui Yin, Celi Muge Wu, Xianfu Chen","2024","IEEE INFOCOM Workshops","Conference Paper"
"69",Multiagent Deep Reinforcement Learning for Dynamic Avatar Migration in AIoT-Enabled Vehicular Metaverses With Trajectory Prediction,"Avatars, as promising digital assistants in Vehicular Metaverses, can enable drivers and passengers to immerse in 3-D virtual spaces, serving as a practical emerging example of Artificial Intelligence of Things (AIoT) in intelligent vehicular environments. The immersive experience is achieved through seamless human–avatar interaction, e.g., augmented reality navigation, which requires intensive resources that are inefficient and impractical to process on intelligent vehicles locally. Fortunately, offloading avatar tasks to roadside units (RSUs) or cloud servers for remote execution can effectively reduce resource consumption. However, the high mobility of vehicles, the dynamic workload of RSUs, and the heterogeneity of RSUs pose novel challenges to making avatar migration decisions. To address these challenges, in this article, we propose a dynamic migration framework for avatar tasks based on real-time trajectory prediction and multiagent deep reinforcement learning (MADRL). Specifically, we propose a model to predict the future trajectories of intelligent vehicles based on their historical data, indicating the future workloads of RSUs. Based on the expected workloads of RSUs, we formulate the avatar task migration problem as a long-term mixed-integer programming problem. To tackle this problem efficiently, the problem is transformed into a partially observable Markov decision process (POMDP) and solved by multiple DRL agents with hybrid continuous and discrete actions in decentralized. Numerical results demonstrate that our proposed algorithm can effectively reduce the latency of executing avatar tasks by around 25% without prediction and 30% with prediction and enhance user immersive experiences in the AIoT-enabled Vehicular Metaverse (AeVeM).","AIoT, Vehicular Metaverse, Avatar Migration, Multi-Agent Deep Reinforcement Learning, Trajectory Prediction","Simulation Platform","Artificial Intelligence and Machine Learning","Edge-Cloud Collaboration","Terminals and Devices",Multi-Agent System,"Quantitative Analysis","Hybrid Experimental Design","Communication and Network","Security and Privacy","Validation Environment","Junlong Chen, Jiawen Kang, Minrui Xu, Zehui Xiong, Dust Nyato, Chuan Chen, Abbas Jamalipour, Shengli Xie","2024",IEEE IOT Journal,"Journal Article"
"70",Navigating the metaverse: unraveling the impact of artificial intelligence—a comprehensive review and gap analysis,"In response to the burgeoning interest in the Metaverse—a virtual reality-driven immersive digital world—this study delves into the pivotal role of AI in shaping its functionalities and elevating user engagement. Focused on recent advancements, prevailing challenges, and potential future developments, our research draws from a comprehensive analysis grounded in meticulous methodology. The study, informed by credible sources including SD, Scopus, IEEE, and WoS, encompasses 846 retrieved studies. Through a rigorous selection process, 54 research papers were identified as relevant, forming the basis for a specific taxonomy of AI in the Metaverse. Our examination spans diverse dimensions of the Metaverse, encompassing augmented reality, virtual reality, mixed reality, Blockchain, Agent Systems, Intelligent NPCs, Societal and Educational Impact, HCI and Systems Design, and Technical Aspects. Emphasizing the necessity of adopting trustworthy AI in the Metaverse, our findings underscore its potential to enhance user experience, safeguard privacy, and promote responsible technology use. This paper not only sheds light on the scholarly interest in the Metaverse but also explores its impact on human behavior, education, societal norms, and community dynamics. Serving as a foundation for future development and responsible implementation of the Metaverse concept, our research identifies and addresses seven open issues, providing indispensable insights for subsequent studies on the integration of AI in the Metaverse.","Metaverse, Artificial Intelligence, Trustworthy AI, Human-Computer Interaction, Ethical Considerations, Virtual Reality, Augmented Reality, Blockchain, Machine Learning, Deep Learning","Metaverse","Digital Twin and Metaverse",Metaverse Multi-Layer,"Virtual and Digital",Deep Learning,"Quantitative Analysis",Theoretical Models,Metaverse,"System Design",Data,"Mohammed A. Fadel, Ali M. Duhaim, A.S. Albahi, Z.T. Al-Qaysi, M.A. Aksam, M.A. Chayadh, Wael Abdul-Aziz, O.S. Albahi, A.H. Alamoudi, Laith Alzubaidi, Ashish Gupta, Yuantong Gu","2024","Artificial Intelligence Review","Journal Article"
"71",Parallel Transportation in TransVerse: From Foundation Models to DeCAST,"Rapid development of AI technologies has propelled the seamless integration of physical and cyber worlds with various kinds of online/offline information collected from millions of multimodal sensing systems. The complexity, diversity and uncertainty inherited in such systems, such as Intelligent Transportation Systems (ITSs), have gone far beyond human capacity of managing and controlling. Our team is among the first to propose the idea of utilizing the nearly unlimited computational resources in cyberspace to construct a bottom-up and top-down combined artificial ITSs for testing, experimenting, representation, verification, and validation of physical ITSs. Especially, the parallel transportation has been developed for safer, smarter, greener, and more reliable transportation services. After three decades of research and field studies, the DeCAST in Transverse, i.e., Decentralized/Distributed Autonomous Operations/Organizations (DAO) in transportation systems, has been envisioned. In this paper, we introduce its architecture, operational processes, software and hardware platforms, and real world applications. Specifically, a transportation foundation model driven by artificial transportation systems, parallel learning and federated intelligence, named TengYun, is outlined for DeCAST.","Parallel traffic, Cyber-Physical-Social Systems, DeCAST, foundational model, Intelligent Transportation System","Simulation Platform","Traffic and Intelligent Systems",Multi-Agent System,"Decision and Management","Deep Learning","Quantitative Analysis",Case Analysis,Data and Models,"System Design",Data,"Zhao Chen, Wang Xiao, Lü Yisheng, Tian Yonglin, Lin Yilun, Wang Feiyue","2023","IEEE Transactions on Intelligent Transportation Systems","Journal Article"
"72",Privacy-Preserving Platooning Control of Vehicular Cyber–Physical Systems With Saturated Inputs,"Metaverse allows the physical reality to tightly integrate with the digital universe. As one typical metaverse application, platooning control of vehicular cyber–physical systems has attracted extensive attention as it is beneficial to improve traffic efficiency, driving safety, and emission reduction. However, due to the open nature of wireless communication networks, the transmitted vehicle-to-vehicle (V2V) data packets become exposed to the public and concomitant data leakage can lead to unintended consequences to vehicular platoons. This article is concerned with the privacy-preserving platooning control issue of vehicular cyber–physical systems with input saturations. First, a novel distributed proportional-integral observer is proposed to estimate the full state of each vehicle, where the integral terms with a forgetting factor facilitate to realize the tradeoff between transient performance and steady-state performance for the platoon. Second, sampled-data-based dynamic encryption and decryption schemes, featuring a dynamic private key, are developed such that the encrypted and decrypted V2V data can be kept private to each platoon vehicle. It is then shown that the platooning control problem over a generic communication topology can be cast into the stability issue of an auxiliary dynamic system. Furthermore, sufficient conditions on the existence of the desired observer and controller gains as well as the private key parameter selection are derived to guarantee the desired platoon stability and privacy preservation requirements. Finally, an illustrative example is given to demonstrate the effectiveness of the proposed control method.","Vehicular CPS, Queue Control, Privacy Protection, PI Observer, Input Saturation","Simulation Platform","Traffic and Intelligent Systems",Communication Network,"Terminals and Devices",Other Techniques,"Quantitative Analysis",Theoretical Models,"Blockchain and Security","Dynamic Adaptability",Validation Environment,"Pan Dengfeng, Ding Derui, Ge Xiaohua, Han Qinglong, Zhang Xianming","2023","IEEE Transactions on Systems, Man, and Cybernetics: Systems","Journal Article"
"73",Proposta de Agente autônomo utilizando as técnicas de mineração de processos em uma Arquitetura Virtual baseada em Sistemas Multiagentes,"The increase of complexity in control production systems, currently requires more flexible and adaptable architectures to comply with demands during runtime. In this way, to apply the concepts of Industry 4.0 around the process management will have a significant impact on the added value, effectiveness and efficiency of the organizations involved with production. Therefore, the purpose of this research is to present an architecture proposal that uses the concept of Process Mining to enable the delivery, automatically, the improvement indicators, such as: reduction of machine downtime, readjustment of the production flow, maintenance costs and assertiveness in fault detection and prediction. This approach foresees the use of a distributed architecture, adhering to the RAMI 4.0 architecture. The advantage of this architecture is the flexibility and distributed e multi-agent control systems. Another advantage is the integration of the physical world and the virtual world with the concept of CPPS (Cyber-Physical Production Systems), thus, bringing flexibility, interoperability and adaptability, that are necessary for the production system.","Process Mining, CPPS, Multi-Agent System, Industry 4.0, RAMI 4.0","Simulation Platform","Multi-Agent System and Reinforcement Learning",Multi-Agent System,"Decision and Management",Other Techniques,"Case Analysis",Case Analysis,"Computing and Resource Management","Validation and Deployment",Validation Environment,"Luana Pinheiro de Souza, Percy Javier Igue Kaneshiro, Oswaldo Luiz Sant'Anna, Francisco Yastami Nakamoto","2021","14th IEEE International Conference on Industry Applications","Conference Paper"
"74","Prospects for multi-agent collaboration and gaming: challenge, technology, and application","
Recent years have witnessed significant im- provement of multi-agent systems for solving vari- ous decision-making problems in complex environ- ments and achievement of similar or even better per- formance than humans. In this study, we briefly review multi-agent collaboration and gaming tech- nology from three perspectives, i.e., task challenges, technology directions, and application areas. We first highlight the typical research problems and chal- lenges in the recent work on multi-agent systems. Then we discuss some of the promising research di- rections on multi-agent collaboration and gaming tasks. Finally, we provide some focused prospects on the application areas in this field.","Multi-Agent System, Collaboration, Games, Reinforcement Learning, Digital Twin","Simulation Platform","Multi-Agent System and Reinforcement Learning","Digital Twin","Terminals and Devices","Deep Learning","Quantitative Analysis",Hybrid Experimental Design,"Metaverse","Validation and Deployment",Security,"Liu Yu, Li Zhi, Jiang Zhizhuo, He You","2022","Frontiers of Information Technology & Electronic Engineering","Journal Article"
"75",QoI-Aware Mobile Crowdsensing for Metaverse by Multi-Agent Deep Reinforcement Learning,"Metaverse is expected to provide mobile users with emerging applications both in regular situation like intelligent transportation services and in emergencies like wireless search and disaster response. These applications are usually associated with stringent quality-of-information (QoI) requirements like throughput and age-of-information (AoI), which can be further guaranteed by using unmanned aerial vehicles (UAVs) as aerial base stations (BSs) to compensate the existing 5G infrastructures. In this paper, we consider a new QoI-aware mobile crowdsensing (MCS) campaign by UAVs which move around and collect data from mobile users wearing metaverse devices. Specifically, we propose “MetaCS”, a multi-agent deep reinforcement learning (MADRL) framework with improvements on a Transformer-based user mobility prediction module between regions and a relational graph learning mechanism to enable the selection of most informative partners to communicate for each UAV. Extensive results and trajectory visualizations on three real mobility datasets in NCSU, KAIST and Beijing show that MetaCS consistently outperforms six baselines in terms of overall QoI index, when varying different numbers of UAVs, throughput requirement, and AoI threshold.","Mobile Crowd Sensing, Metaverse, UAVs, Multi-Agent Deep Reinforcement Learning, QoI, AoI","Simulation Platform","Digital Twin and Metaverse","Digital Twin","Terminals and Devices","Deep Learning","Quantitative Analysis",Hybrid Experimental Design,"Computing and Resource Management","Technology Integration",Scenario,"Ye Yuxiao, Wang Hao, Liu Chi, Dai Zipeng, Li Guoqing, Wang Guoren, Tang Jian","2024","IEEE Journal on Selected Areas in Communications","Journal Article"
"76",Quantum Reinforcement Learning for Spatio-Temporal Prioritization in Metaverse,"A metaverse is composed of a physical-space and virtual-space, with the aim of having users in both the virtual reality and the real world experience. Prioritization is essential, but it is not straight-forwarded due to the limitation of computing resources in real-world, making it impossible to synchronize all data. Therefore, it is crucial to allocate resources based on regional preferences in physical-space and content preferences of users in virtual-space. The referencing system consists of two-stage sub-computations, 1) spatial-prioritization for more data gathering under the consideration of avatar-popularity one top of physical-space and 2) temporal-prioritization for virtual-space rendering under the avatar-popularity. Both prioritization tasks are combinatorics problems and are well-known NP-hard. The problem scale is also large, making it difficult to solve within given times. The classical deep learning cannot be the solution. Quantum-based learning algorithms can be the potential solutions due to high-performance computing capabilities, because a small number of qubits can represent an exponentially large amount of information. On top of these advantages, an improved quantum reinforcement learning (QRL) algorithm is proposed for reducing the control dimensions into a logarithmic scale. We corroborate that our proposed QRL-based algorithm for low-dimensional spatio-temporal prioritization improves convergence and performance.","Metaverse, Scheduling, Quantum Neural Networks, Quantum Reinforcement Learning","Metaverse","AI and Machine Learning","Quantum Computing","Decision and Management","Other Techniques","Quantitative Analysis",Specific Technology Experiment,"Computing and Resource Management","Validation and Deployment",Technology Integration,"Park Soohyun, Baek Hanjie, Kim Jongheon","2024","IEEE Access","Journal Article"
"77",Quantum-enhanced Federated Learning for Metaverse-empowered Vehicular Networks,"In the rapidly evolving domain of vehicular metaverse, this study introduces a cutting-edge quantum-based decentralized and heterogeneity-aware federated learning framework for vehicular metaverse named QV-FEDCOM, which stands as a testament to the innovative fusion of quantum computing principles with federated learning (FL). This framework is ingeniously tailored to address the challenges in a vehicular metaverse, offering a cost-efficient and adaptive solution for the dynamic vehicular landscape. QV-FEDCOM is strengthened by key components like quantum sequential-training-program, with reinforcement learning-based dynamic mode switching to reduce communication costs and manage vehicle states adaptively, and the quantum vehicle-context-grouping utilizing hierarchical clustering and simulated annealing for effective vehicle grouping based on contextual data similarity, addressing the complexities of data heterogeneity. Additionally, the integration of quantum-inspired principal component analysis (Q-PCA) enhances memory efficiency, further optimizing the framework. These elements converge in the QV-FEDCOM algorithm, establishing a decentralized, efficient, and context-aware quantum federated learning (QFL) process that redefines learning dynamics in the vehicular metaverse. Our study also introduces an innovative quantum trajectory loss (QTL) function, specifically designed for trajectory prediction tasks, which combines the Huber loss with an angular deviation penalty to robustly handle errors and penalize large deviations in the predicted trajectory angle. The effectiveness of the QV-FEDCOM framework is rigorously validated through comprehensive simulations, with its performance meticulously compared against various adaptations, showcasing its transformative capabilities within the vehicular metaverse ecosystem.","Quantum Federated Learning, Vehicular Metaverse, Quantum Neural Networks, Resource Allocation, Trajectory Prediction","Simulation Platform","Digital Twin and Metaverse","Edge-Cloud Collaboration","Terminals and Devices",Hybrid Algorithms,"Quantitative Analysis","Specific Technology Experiment","Data and Models","Scenario Scalability","Technology Integration","Bishmita Hazarika, Kaishav Singh, Octavia A. Dobre, Li Zhipeng, Du Ong Trung Q.","2024",IEEE Transactions on Communications,"Journal Article"
