title,abstract,keywords
Current opportunities and challenges of immersive virtual reality for psychological research and application,"Immersive virtual reality (iVR), that is, digital stereoscopic 360° scenarios usually presented in head-mounted displays, has gained much popularity in medical, educational, and consumer contexts in the last years. Recently, psychological research started to utilize the theoretical and methodological advantages of iVR. Furthermore, understanding cognitive, emotional, and behavioral processes in iVR similar to real-life is a genuinely psychological, currently understudied topic. This article briefly reviews the current application of iVR in psychological research and related disciplines. The review presents empirical evidence for opportunities and strengths (e.g., realism, experimental control, effectiveness of therapeutic and educational interventions) as well as challenges and weaknesses (e.g., differences in experiencing presence, interacting with VR content including avatars, i.e., graphical representation of a person). The main part discusses areas requiring additional basic research, such as cognitive processes, socio-emotional processes during social interactions in iVR, and possible societal implications (e.g., fraud, VR-addiction). For both research and application, iVR offers a contemporary extension of the psychological toolkit, offering new avenues to investigate and enhance core phenomena of psychology such as cognition, affect, motivation, and behavior. Still, it is crucial to exercise caution in its application as excessive and careless use of iVR can pose risks to individuals' mental and physical well-being.","Virtual reality, Cognitive processes, Socio-emotional processes, Psychotherapy, Education, Societal implications"
"Scenario-based analysis for industrial project planning in the context of carbon peaking: Case study city, China","The Chinese government is actively pursuing a low-carbon development model with a clear target of reducing carbon dioxide (CO2) emissions by 2030. This study presents a project-based perspective on CO2 emissions from the industrial sector in the city. The article quantifies and analyzes the project planning by including the entire gross industrial production value, industrial structure, energy intensity, energy structure, and CO2 emission coefficient of the industrial sector's CO2 emissions decomposition model. Monte Carlo simulation and scenario analysis were coupled to evaluate how the city's industrial sector could achieve its peak carbon targets by industry. The expected range of CO2 emissions from the city's industrial sector in 2025, 2030, and 2035, based on the project plan and policies in place, is projected to be between 65.64 and 69.26 Mt, 72.13–78.48 Mt, and 69.32–76.62 Mt. However, the simulations show that there are still considerable uncertainties in reaching the peak carbon target in 2030, necessitating greater government efforts. To achieve the 2030 goal for the city's industrial sector, the paper recommends that the government increase the baseline criteria for industrial structure, energy intensity, and energy structure. This study provides scientific project planning guidance for Chinese cities to successfully achieve the 2030 goal.","Carbon peaking, Project planning, Industry sector, City, Monte Carlo"
An intelligent glove interface with integrated perceptual simulation and motion tracking for enhanced virtual interactions,"Summary Emerging technologies that bridge the real and virtual worlds are pivotal for enhancing virtual interactions. Current devices, such as smart gloves, often focus solely on hand motion tracking or provide limited haptic feedback, restricting user experiences. Here, a haptic intelligent motion tracking (HIMT) glove designed for enhanced virtual interactions is proposed. The glove includes optimized electromagnetic vibrators that allow users to perceive the shapes and weights of virtual objects accurately. Additionally, graphene fiber sensors were developed for upper-limb motion tracking incorporating inertial measurement units (IMUs). Evaluations in virtual interactive physiotherapy demonstrate that the glove enhances the willingness to engage in rehabilitation training. Furthermore, users achieve a high diagnostic accuracy of 96.1% when assessing virtual patients. The HIMT glove demonstrates significant potential as a comprehensive solution for human-virtual interactions, promising wide future applications in fields such as physiotherapy, medical training, education, sports, and entertainment.","smart glove, electromagnetic vibrator, fiber sensor, motion tracking, virtual reality, physiotherapy, clinical diagnosis"
21st century progress in computing,"In the search for explanations for slower productivity growth since the mid-2000s in many countries, one possibility is a slower pace of progress in digital technologies. In this paper we show that the cost of computation has continued to decline rapidly, taking into account innovation in chip types and cloud computing. This is a continuation of its long-run trend; the decline has slowed since 2010, but not earlier. As firms use computational power along with other inputs including relevant human and organisational capital, to the extent that the productivity slowdown is linked to technology use the explanation is likely to lie in these other elements of the input bundle.","Computation, Prices, Productivity, AI, Cloud computing"
Generative artificial intelligence in innovation management: A preview of future research developments,"This study outlines the future research opportunities related to Generative Artificial Intelligence (GenAI) in innovation management. To this end, it combines a review of the academic literature with the results of a Delphi study involving leading innovation management scholars. Ten major research themes emerged that can guide future research developments at the intersection of GenAI and innovation management: 1) Gen AI and innovation types; 2) GenAI, dominant designs and technology evolution; 3) Scientific and artistic creativity and GenAI-enabled innovations; 4) GenAI-enabled innovations and intellectual property; 5) GenAI and new product development; 6) Multimodal/unimodal GenAI and innovation outcomes; 7) GenAI, agency and ecosystems; 8) Policymakers, lawmakers and anti-trust authorities in the regulation of GenAI-enabled innovation; 9) Misuse and unethical use of GenAI leading to biased innovation; and 10) Organizational design and boundaries for GenAI-enabled innovation. The paper concludes by discussing how these themes can inform theoretical development in innovation management studies.","Generative artificial intelligence, Delphi study, Management, Innovation"
A value-oriented Artificial Intelligence-as-a-Service business plan using integrated tools and services,"The latest developments in Artificial Intelligence (AI) are the focal point in increasing the performance of other technologies and the evolution of Industry 4.0. Considering the benefits of AI in today’s world, businesses must move towards using Integrated AI tools and services. This paper introduces a business model based on AI-as-a-Service (AIaaS), which provides an integrated bundle of AI products and services. The strategic approach, roadmap, and heuristic pricing model provided in this paper can be considered as a benchmark for AIaaS companies.","Artificial Intelligence-as-a-service, Industry 4.0, Machine vision, Natural language processing, Data-driven systems, Heuristic pricing"
Balancing privacy and performance in federated learning: A systematic literature review on methods and metrics,"Federated learning (FL) as a novel paradigm in Artificial Intelligence (AI), ensures enhanced privacy by eliminating data centralization and brings learning directly to the edge of the user's device. Nevertheless, new privacy issues have been raised particularly during training and the exchange of parameters between servers and clients. While several privacy-preserving FL solutions have been developed to mitigate potential breaches in FL architectures, their integration poses its own set of challenges. Incorporating these privacy-preserving mechanisms into FL at the edge computing level can increase both communication and computational overheads, which may, in turn, compromise data utility and learning performance metrics. This paper provides a systematic literature review on essential methods and metrics to support the most appropriate trade-offs between FL privacy and other performance-related application requirements such as accuracy, loss, convergence time, utility, communication, and computation overhead. We aim to provide an extensive overview of recent privacy-preserving mechanisms in FL used across various applications, placing a particular focus on quantitative privacy assessment approaches in FL and the necessity of achieving a balance between privacy and the other requirements of real-world FL applications. This review collects, classifies, and discusses relevant papers in a structured manner, emphasizing challenges, open issues, and promising research directions.","Distributed artificial intelligence, Federated learning, Cybersecurity, Trustworthiness, Performance evaluation"
"Computational approaches to Explainable Artificial Intelligence: Advances in theory, applications and trends","Deep Learning (DL), a groundbreaking branch of Machine Learning (ML), has emerged as a driving force in both theoretical and applied Artificial Intelligence (AI). DL algorithms, rooted in complex and non-linear artificial neural systems, excel at extracting high-level features from data. DL has demonstrated human-level performance in real-world tasks, including clinical diagnostics, and has unlocked solutions to previously intractable problems in virtual agent design, robotics, genomics, neuroimaging, computer vision, and industrial automation. In this paper, the most relevant advances from the last few years in Artificial Intelligence (AI) and several applications to neuroscience, neuroimaging, computer vision, and robotics are presented, reviewed and discussed. In this way, we summarize the state-of-the-art in AI methods, models and applications within a collection of works presented at the 9th International Conference on the Interplay between Natural and Artificial Computation (IWINAC). The works presented in this paper are excellent examples of new scientific discoveries made in laboratories that have successfully transitioned to real-life applications.","Explainable Artificial Intelligence, Data science, Computational approaches, Machine learning, Deep learning, Neuroscience, Robotics, Biomedical applications, Computer-aided diagnosis systems"
In search of better methods for the longitudinal assessment of tech-derived X-risks: How five leading scenario planning efforts can help,"This mixed methods article discusses the role of scenario analysis as a tool to assess the broadest possible specter of positive and negative effects of technologies and social processes within current existential risk assessment and research. To do so, it compares and contrasts case studies of five ongoing, longitudinal scenario planning efforts of global nature– the Shell scenarios, the Intergovernmental Panel on Climate Change (IPCC), the CSIS Seven Revolutions Scenarios, The Millennium Project's State of The Future, and the NIC's Global Trends 2040, to derive lessons for whether and how the adjacent existential risk (X-risk) and tech assessment communities can better deploy scenario planning methodology. Observations are derived from interviews with practitioners involved in these efforts as well as an assessment of the publicly available material issued by each project, including the scenarios produced. The emphasis is on the methodologies used, the timelines considered, the forces each identifies as important scenario drivers, and the process of engagement once scenarios are created. Three practices identified include (1) constructing narratives based on strong data, (2) sticking to plausible scenarios (not wild cards), and (3) designing a process of engagement, which each of these does well albeit in different ways. The article concludes with a few brief recommendations for future scenario planning efforts, particularly relevant for x-risk studies that aim to be relevant for tech assessment and governance. Overall, this review shows global scenario efforts aimed at influencing governance would benefit from (a) a more uniformly shared vocabulary, (b) an underlying theory of cascading systemic change, (c) deeper methodological transparency, (d) increased transdisciplinary perspectives, yet (e) maintaining scientific rigor. These improvements would particularly benefit emerging tech-risk derived X-risk scenario efforts where the stakes are the highest they could be, safeguarding humanity's future.","Forecasting, Methods, Human extinction, Global catastrophic risks (GCRs), Scenario methods, Existential risks"
Federated Learning for improved prediction of failures in Autonomous Guided Vehicles,"Autonomous Guided Vehicles (AGVs) are nowadays an indispensable component of production lines in smart manufacturing. Managing the fleet of AGVs covers not only the delegation of operational tasks but also the monitoring of AGVs activity and health condition by applying tailored Machine Learning-based methods to detect anomalies in various signals gathered by edge IoT devices mounted on board. Detecting anomalies requires appropriate prediction of selected signals based on multiple types of sensor readings. Momentary energy consumption is one of the signals that can indicate abnormal states in AGVs. In this paper, we show that the prediction of this signal can be improved with the Federated Learning (FL) approach that involves exchanging experience gained by particular AGVs. This paper significantly extends the conference paper (Shubyn et al., 2022) with the new multi-round approach to building global prediction models and recent experiments on real data streams produced by AGVs designed by the AIUT company. The results of our experiments prove that in the AGV operational environments with distributed knowledge Federated Learning performs better than traditional centralized approaches and that frequent synchronization of experience may lead to better prediction quality.","Federated Learning, Autonomous Guided Vehicles, Smart manufacturing, Prediction, Industry 4.0"
"Smart-enhanced organisational functions: A framework comprising capabilities, barriers, and evolutional path","Integrating smart industrial products (SIPs) into production processes introduces new dynamics of capabilities and challenges within organisations. However, a prevalent issue is the ad hoc adoption of SIPs without a cohesive strategy, resulting in isolated solutions that do not effectively enhance core organisational functions. Our research fills this critical gap by identifying and combining the capabilities and barriers posed by SIPs. Our findings allow us to propose a framework comprising the stages each main organisational function needs to develop to move from a traditional to a completely autonomous decision-making function. This evolutional path requires that each organisational function acquires selected capabilities and overcomes specific barriers. Our approach encompasses a multi-method methodology, commencing with a systematic literature review (SLR) encompassing 44 papers, leading to the identification of 20 capabilities and 23 barriers. Subsequently, through rigorous content analyses and expert interviews, we formulate the framework. This paper contributes to academia by providing a framework with an evolutional path that main organisational functions may follow according to the capability they acquire from the SIP and which barriers should be surpassed at each level. For managers in practice, the proposed framework enables a better understanding of the stage of their operations and which capabilities will take their main organisational function from traditional (level 0) to autonomous (level 3) stages.","Barriers, Capabilities, Connected products, Smart production, Smart industrial products"
Digital Twin based Smart Manufacturing; From Design to Simulation and Optimization Schema,"The advent of new-generation information and communication technologies, such as Generative AI, Internet of Things (IoT), big data analytics, Blockchain technology, and artificial intelligence (AI), has led to the emergence of the era of big data in recent years. Digital twin has emerged as one of the most active components in smart manufacturing, garnering significant attention from enterprises, research institutes, and researchers. By creating a digital twin, manufacturers can simulate different scenarios and test various configurations without disrupting the actual production process. This allows for more efficient testing and optimization of production processes, as well as improved quality control and predictive maintenance. Overall, digital twins are an important tool in smart production that can help manufacturers improve efficiency and reduce costs while ensuring high-quality output. In this paper, after reviewing the literature on the subject, in this article, by reviewing the literature, we presented a framework of the digital twin in smart manufacturing, which includes Optimization, Predictive Maintenance, Quality Control, Design, and Simulation, which can be a good guide for future studies.","Digital Twin, Smart Manufacturing, Internet of Things, Predictive Maintenance, Optimization & Simulation"
"ACMSD inhibition corrects fibrosis, inflammation, and DNA damage in MASLD/MASH","Background & Aims Recent findings reveal the importance of tryptophan-initiated de novo nicotinamide adenine dinucleotide (NAD+) synthesis in the liver, a process previously considered secondary to biosynthesis from nicotinamide. The enzyme α-amino-β-carboxymuconate-ε-semialdehyde decarboxylase (ACMSD), primarily expressed in the liver and kidney, acts as a modulator of de novo NAD+ synthesis. Boosting NAD+ levels has previously demonstrated remarkable metabolic benefits in mouse models. In this study, we aimed to investigate the therapeutic implications of ACMSD inhibition in the treatment of metabolic dysfunction-associated steatotic liver disease/steatohepatitis (MASLD/MASH). Methods In vitro experiments were conducted in primary rodent hepatocytes, Huh7 human liver carcinoma cells and induced pluripotent stem cell-derived human liver organoids (HLOs). C57BL/6J male mice were fed a western-style diet and housed at thermoneutrality to recapitulate key aspects of MASLD/MASH. Pharmacological ACMSD inhibition was given therapeutically, following disease onset. HLO models of steatohepatitis were used to assess the DNA damage responses to ACMSD inhibition in human contexts. Results Inhibiting ACMSD with a novel specific pharmacological inhibitor promotes de novo NAD+ synthesis and reduces DNA damage ex vivo, in vivo, and in HLO models. In mouse models of MASLD/MASH, de novo NAD+ biosynthesis is suppressed, and transcriptomic DNA damage signatures correlate with disease severity; in humans, Mendelian randomization-based genetic analysis suggests a notable impact of genomic stress on liver disease susceptibility. Therapeutic inhibition of ACMSD in mice increases liver NAD+ and reverses MASLD/MASH, mitigating fibrosis, inflammation, and DNA damage, as observed in HLO models of steatohepatitis. Conclusions Our findings highlight the benefits of ACMSD inhibition in enhancing hepatic NAD+ levels and enabling genomic protection, underscoring its therapeutic potential in MASLD/MASH. Impact and implications Enhancing NAD+ levels has been shown to induce remarkable health benefits in mouse models of metabolic dysfunction-associated steatotic liver disease/steatohepatitis (MASLD/MASH), yet liver-specific NAD+ boosting strategies remain underexplored. Here, we present a novel pharmacological approach to enhance de novo synthesis of NAD+ in the liver by inhibiting α-amino-β-carboxymuconate-ε-semialdehyde decarboxylase (ACMSD), an enzyme highly expressed in the liver. Inhibiting ACMSD increases NAD+ levels, enhances mitochondrial respiration, and maintains genomic stability in hepatocytes ex vivo and in vivo. These molecular benefits prevent disease progression in both mouse and human liver organoid models of steatohepatitis. Our preclinical study identifies ACMSD as a promising target for MASLD/MASH management and lays the groundwork for developing ACMSD inhibitors as a clinical treatment.","NAD, ACMSD, DNA repair, MASLD/MASH, Mendelian randomization, human liver organoids"
Hedging with automatic liquidation and leverage selection on bitcoin futures,"Bitcoin derivatives positions are maintained with a self-selected margin, which is often too low to avoid automatic liquidation by the exchange, without notice, especially during periods of excessive volatility. Indeed, according to CryptoQuant, almost $80 billion of positions on centralised exchanges were liquidated during 2021, that is an average of over $200 million per day. So hedgers of bitcoin price risk should account for the possibility of automatic liquidation when taking positions on bitcoin futures. We derive a semi-closed form for an optimal hedging strategy with dual objectives – to minimize both the variance of the hedged portfolio and the probability of liquidation due to insufficient collateral. The solution depends on the statistical characteristics of the spot and futures extreme returns, and other parameters that characterize the hedger by choice of leverage, loss aversion and collateral management. An empirical analysis based on minute-level data compares the performance of the major direct and inverse bitcoin hedging instruments traded on five major exchanges.","Finance, Cryptocurrency, Leverage, Liquidation, Perpetual swap"
CrowdRouting: Trustworthy and customized cross-domain routing based on crowdsourcing,"Cross-domain routing in Integrated Heterogeneous Networks (Inte-HetNet) should ensure efficient and secure data transmission across different network domains by satisfying diverse routing requirements. However, current solutions face numerous challenges in continuously ensuring trustworthy routing, fulfilling diverse requirements, achieving reasonable resource allocation, and safeguarding against malicious behaviors of network operators. We propose CrowdRouting, a novel cross-domain routing scheme based on crowdsourcing, dedicated to establishing sustained trust in cross-domain routing, comprehensively considering and fulfilling various customized routing requirements, while ensuring reasonable resource allocation and effectively curbing malicious behavior of network operators. Concretely, CrowdRouting employs blockchain technology to verify the trustworthiness of border routers in different network domains, thereby establishing sustainable and trustworthy cross-domain routing based on sustained trust in these routers. In addition, CrowdRouting ingeniously integrates a crowdsourcing mechanism into the auction for routing, achieving fair and impartial allocation of routing rights by flexibly embedding various customized routing requirements into each auction phase. Moreover, CrowdRouting leverages incentive mechanisms and routing settlement to encourage network domains to actively participate in cross-domain routing, thereby promoting optimal resource allocation and efficient utilization. Furthermore, CrowdRouting introduces a supervisory agency (e.g., undercover agent) to effectively suppress the malicious behavior of network operators through the game and interaction between the agent and the network operators. Through comprehensive experimental evaluations and comparisons with existing works, we demonstrate that CrowdRouting excels in providing trustworthy and fine-grained customized routing services, stimulating active participation in cross-domain routing, inhibiting malicious operator behavior, and maintaining reasonable resource allocation, all of which outperform baseline schemes.","Trustworthy routing, Cross-domain routing, Customized routing, Crowdsourcing"
"Human versus virtual influences, a comparative study","Influencer marketing aims to promote brands and influence consumer decisions, and recent technological advances have created options for non-human, virtual influencers. Such developments suggest the need to determine whether the effects of virtual influencers on consumer decisions differ from those of human influencers, depending on the type of product they are promoting. With a 2 (virtual vs. human influencer) × 2 (utilitarian vs. hedonic product) experimental design, using Instagram influencer posts and data from 275 participants, the current research establishes that the type of influencer does not affect intentions to adopt recommendations. But the influence process varies by type of influencer: Virtual influencers’ recommendations appear more useful, especially for utilitarian products, but consumers identify more with human influencers’ posts. Both usefulness and identification increase intention to adopt influencers’ recommendation. Overall, these results suggest that, while virtual influencers should endorse utilitarian products, human influencers should be hired to endorse hedonic products.","Virtual influencer, Human influencer, Identification, Usefulness, Behavioral intention, Type of product"
